"tweet_id","in_reply_to_status_id","in_reply_to_user_id","retweeted_status_id","retweeted_status_user_id","timestamp","source","text","expanded_urls"
"86295072","","","","","2007-06-01 04:48:19 +0000","web","New blog post: Heading to Oklahoma for the weekend http://tinyurl.com/2ae242"
"86253132","","","","","2007-06-01 04:05:27 +0000","web","Home from Temple Gardens Mineral Spa...daughter's birthday request.
http://www.templegardens.sk.ca/"
"85703642","","","","","2007-05-31 17:49:49 +0000","web","New blog post: GPS with the kids http://tinyurl.com/ysjbzl"
"85702912","","","","","2007-05-31 17:48:51 +0000","web","New blog post: Geocaching and my 73 year old father http://tinyurl.com/23ljrq"
"85521032","85245752","1285451","","","2007-05-31 15:12:03 +0000","web","@dweinberger...private conf on open access? hmmmmm....."
"85518822","","","","","2007-05-31 15:10:24 +0000","web","Came to work, our wireless router was hot and burning...it was fried.  Tech guys are already here trying to get another going."
"85028622","","","","","2007-05-31 07:14:26 +0000","web","fixed it....I'm such a hack..I mean that in all the wrong ways."
"85017012","","","","","2007-05-31 07:02:05 +0000","web","why is my blog all borked?"
"84997842","","","","","2007-05-31 06:39:27 +0000","web","How did that happen?
http://flickr.com/photos/shareski/58369048/"
"84997522","","","","","2007-05-31 06:38:59 +0000","web","Daughter turns 15 today 
http://flickr.com/photos/shareski/419153591/"
"84589102","","","","","2007-05-30 23:12:05 +0000","web","New blog post: Paying at the Pump http://tinyurl.com/ypea88"
"83672172","","","","","2007-05-30 07:24:56 +0000","web","late night...3 blog posts, updated theme, good work Dean, you'll pay in the morning! Nite."
"83614942","","","","","2007-05-30 06:11:39 +0000","web","New blog post: Do you like what I'm wearing? http://tinyurl.com/278oh8"
"83485232","","","","","2007-05-30 03:47:17 +0000","web","working on a new theme for my blog....http://ideasandthoughts.org...thanks to robwall's inspiration."
"83270722","","","","","2007-05-30 00:12:52 +0000","web","New blog post: The Lot...good TV http://tinyurl.com/2c5ax5"
"83262602","","","","","2007-05-30 00:03:57 +0000","web","Watching The Lot on Fox."
"82870912","","","","","2007-05-29 17:21:08 +0000","web","setting up my undergrad course in Moodle."
"81968772","","","","","2007-05-29 02:17:53 +0000","web","left my power cord at my meeting...good thing I have a spare battery for this evening's work."
"81732982","","","","","2007-05-28 20:52:06 +0000","web","at a meeting with a provincial committee focus group."
"81595302","","","","","2007-05-28 16:21:20 +0000","web","because of dkuropatwa, spend the last half hour thinking, commenting and writing...thanks for the extra work!"
"81100262","","","","","2007-05-28 03:47:24 +0000","web","neighbor has his hot tub working again...perfect evening for a dip, I'll supply the entertainment, got some nice torrents downloaded."
"81048442","","","","","2007-05-28 02:55:28 +0000","web","enjoying a post round BBQ burger, celebrating my best round for a few years.73"
"80826552","","","","","2007-05-27 22:26:14 +0000","web","nice night for an evening round of ""you know what"". Hint: in my house it's a four letter word."
"80819592","","","","","2007-05-27 22:17:24 +0000","web","installed twitter gadget for google ig"
"79936232","79913972","2327681","","","2007-05-27 03:28:48 +0000","web","@alexragone...any advice on accommodations in NYC?"
"79887092","","","","","2007-05-27 02:22:15 +0000","web","Enjoying that coffee and impending sunset on the deck http://flickr.com/photos/shareski/515460621/"
"79753822","","","","","2007-05-26 23:23:12 +0000","web","Nice Saturday, yard work, clean deck and vehicles, sunny 65F, perfect evening for a walk and coffee on the deck."
"78630262","","","","","2007-05-26 00:16:39 +0000","web","neighbour just called said the burgers were ready....GTG"
"78546212","","","","","2007-05-25 22:34:14 +0000","web","done for the night....finished rough draft of video for Board presentation
http://www.prairiesouth.ca/videos/dl.wmv  still needs work"
"78470172","","","","","2007-05-25 20:54:02 +0000","web","why do people still use the ""out of office"" feature? Isn't your ""office"" wherever you want it to be?"
"78466372","","","","","2007-05-25 20:49:59 +0000","web","I love it when Stephen Downes comments on my blog:
http://tinyurl.com/24ej6l"
"78439442","","","","","2007-05-25 20:20:18 +0000","web","New blog post: Possibility vs. Probability http://tinyurl.com/24ej6l"
"78432882","","","","","2007-05-25 20:12:58 +0000","web","New blog post: Possibility vs. Probability http://tinyurl.com/24ej6l"
"78338502","","","","","2007-05-25 18:36:49 +0000","web","movie crew at our house right now scouting out the joint...hope it's a Julia Roberts film ;)"
"77205052","76825452","1424681","","","2007-05-25 00:03:26 +0000","web","@budtheteacher...Congrats...Teagan and Ani isn't it?  Weird  I don't even know the names of my neighbour's baby."
"75899092","","","","","2007-05-24 00:01:17 +0000","web","Local paper writing about our grade one blogging teacher http://tinyurl.com/yq8osb"
"75884102","","","","","2007-05-23 23:43:59 +0000","web","impromptu SKypes from Ewan McIntosh, Miguel Guhlin...I like that."
"75461582","","","","","2007-05-23 16:32:48 +0000","web","@dnorman...I'll use that as my first point....here's a rough draft, http://tinyurl.com/2ecoc2"
"75413512","","","","","2007-05-23 15:42:54 +0000","web","Trying to write a content filtering guiding principles document....any ideas, suggestions, links...Come on Twits, I need  you!"
"75385522","","","","","2007-05-23 15:08:46 +0000","web","they closed 5 schools in our district last night....declining enrollment."
"74811712","","","","","2007-05-23 05:12:40 +0000","web","just about done golf video...21minutes of golf and 4 of everything else...that sounds about right."
"74271012","","","","","2007-05-22 17:47:09 +0000","web","lunch has just been brought in...I can smell it...I think it's Chinese."
"74242562","74239072","1298301","","","2007-05-22 17:19:20 +0000","web","@edventures...had a Bacon Ranch Dog the other day..replace the BBQ sauce with Ranch dressing...beautiful!"
"74102922","","","","","2007-05-22 15:33:25 +0000","web","Waiting for a meeting to begin with provincial elearning folks; sort of a self made group eager to discuss digital learning in their schools"
"73338792","","","","","2007-05-22 03:21:50 +0000","web","Editing my golf trip video...a bit over the top but that's the point. Here's the intro:
http://tinyurl.com/2g3t7j"
"72702632","","","","","2007-05-21 16:35:15 +0000","web","making brunch for family...Canadian holiday...tee time is at 11:57, PS. Thanks Durff"
"72064902","","","","","2007-05-21 05:37:50 +0000","web","Beautiful evening here in Moose Jaw...nice walk with my dog and Dad and wife.
http://flickr.com/photos/shareski/507220047/"
"72017582","72001262","5634392","","","2007-05-21 04:40:11 +0000","web","@dkuropatwa...what's wiaoc?  URL please."
"71882992","71860022","673153","","","2007-05-21 02:15:37 +0000","web","@timlauer....Bandon Dunes....almost heaven."
"70933572","","","","","2007-05-20 06:10:58 +0000","web","Played golf in cold, wind and rain.  Temp went from 31C or 89F on Thursday to 9C or 49F today...Welcome to Saskatchewan!"
"70428892","","","","","2007-05-19 19:25:15 +0000","web","Cool windy day but planning to golf anyway
http://tinyurl.com/26ppmc"
"69204932","","","","","2007-05-18 20:45:57 +0000","web","New blog post: Podcast 28 Telling the New Story...one year later http://tinyurl.com/2g7ncw"
"69187612","","","","","2007-05-18 20:28:38 +0000","web","It's Friday, I'm tired but am looking forward to a long weekend"
"68964212","","","","","2007-05-18 17:10:31 +0000","web","listening to IT guys discuss using IE7 or FireFox....Our group policy can't manage FireFox"
"68207102","","","","","2007-05-18 06:49:54 +0000","web","New blog post: Podcast 28 Telling the New Story...one year later http://tinyurl.com/2g7ncw"
"68202532","","","","","2007-05-18 06:44:51 +0000","web","New blog post: Podcast 28 Telling the New Story...one year later http://tinyurl.com/2g7ncw"
"68181322","","","","","2007-05-18 06:22:22 +0000","web","New blog post: My day in Photos http://tinyurl.com/2cbujz"
"68179312","","","","","2007-05-18 06:19:59 +0000","web","New blog post: Podcast 28 Telling the New Story...one year later http://tinyurl.com/2g7ncw"
"68174702","","","","","2007-05-18 06:14:53 +0000","web","Thanks Darren, now convince me I need Facebook.  I did join but not sure why yet."
"68158302","","","","","2007-05-18 05:59:20 +0000","web","Power outage in the city for an hour tonight...played Catan with kids in candlelight...they wanted to keep the lights off even afterwards"
"68151072","","","","","2007-05-18 05:51:21 +0000","web","Convince me I need to join jaiku"
"67968132","67218252","3110991","","","2007-05-18 02:55:26 +0000","web","@julielindsay and coolcatteacher...showed your wikis during my workshop today...pretty well the exemplar model!"
"67946742","67576452","10139","","","2007-05-18 02:33:25 +0000","web","@teach42...thanks for the new shirt and laptop. You are one generous dude! http://flickr.com/photos/shareski/502786824/"
"67800982","","","","","2007-05-17 23:59:12 +0000","web","office finale tonight..."
"67800632","","","","","2007-05-17 23:58:54 +0000","web","In a wiki workshop...just finished supper"
"67613852","","","","","2007-05-17 20:58:08 +0000","web","Found a Fanta Orange soda in the fridge...haven't had a Fanta for years, didn't even know they still existed"
"67558932","","","","","2007-05-17 20:04:46 +0000","web","Splashcast presentation I created for Internet Safety  http://web.splashcast.net/catalog/channel_details.aspx?code=HWWL3647KO  Suggestions?"
"67422282","66565812","4453771","","","2007-05-17 17:59:14 +0000","web","@qdsouza...borrowing ideas from your splashcast show on Internet Privacy...I'll link it when it's done."
"66488762","","","","","2007-05-17 03:28:16 +0000","web","searching for accommodations in NYC for July. Checking vrbo.com and craiglists...any suggestions?"
"66346032","","","","","2007-05-16 23:43:31 +0000","web","New blog post: Podcast 28 Telling the New Story...one year later http://ideasandthoughts.org/2007/05/16/podcast-28-telling-the-new-storyone-"
"65814102","","","","","2007-05-16 05:29:59 +0000","web","rendering podcast from last night....it's a good one."
"65810742","65759802","4453771","","","2007-05-16 05:25:37 +0000","web","@qdsouza...congrats as well....if you have 2 you may as well go for four!  Makes no difference."
"65746672","","","","","2007-05-16 04:12:57 +0000","web","Funny Canadian Comedian Gerry Dee. Former teacher  http://tinyurl.com/2dt8mz funny stuff!"
"65146262","","","","","2007-05-15 17:52:47 +0000","web","New blog post: EdTech Posse Rides on http://tinyurl.com/22cstj"
"65140322","65126922","422303","","","2007-05-15 17:46:27 +0000","web","@digimom....you go girl!"
"65093332","","","","","2007-05-15 16:57:34 +0000","web","New blog post: That's what I'm talkin' 'bout http://tinyurl.com/2yhy9u"
"65057712","","","","","2007-05-15 16:16:11 +0000","web","Want to add something....feel free  http://shareski.wikispaces.com/ge any twits with an interest in Google Earth, you can join in at 1PM MST"
"65056442","","","","","2007-05-15 16:14:48 +0000","web","planning for a morning of geocaching, and gps with high school students and my afternoon workshop on Google Earth with teachers."
"65037132","65009682","2327681","","","2007-05-15 15:52:56 +0000","web","@alexragone....any advice on accommodations for NYC for July?"
"64595412","64563002","5634392","","","2007-05-15 05:46:55 +0000","web","@dkuropatwa....get to bed!"
"64538362","","","","","2007-05-15 04:27:05 +0000","web","Skyping with dkuropatwa, glassbeed and kathy Cassidy.....will post the podcast soon!  Recording with Pretty May"
"63866162","","","","","2007-05-14 16:45:35 +0000","web","@donnaderoches and robwall...was thinking the same thing...want that template with my rotating banners...can that work?"
"63777632","63712332","4339081","","","2007-05-14 14:54:44 +0000","web","@crafty184  flickr slideshows are embeddable....http://tinyurl.com/s9tnn"
"63234532","63221122","5936222","","","2007-05-14 03:10:09 +0000","web","@donnadesroches...been there, done that."
"63202442","","","","","2007-05-14 02:30:59 +0000","web","relieving??? I meant to say revealing... I did not relieve myself in SL!"
"63198862","","","","","2007-05-14 02:26:29 +0000","web","Just talked to teach42 in SL...got in trouble for relieving 1st life info...hey, he asked me for it , guess I'm not much into privacy."
"63197772","63157892","1424681","","","2007-05-14 02:25:31 +0000","web","@budtheteacher....that's my story too...I""m allowed to have the laptop which helps"
"63027652","","","","","2007-05-13 23:13:27 +0000","web","GTG, Family wants to play Catan http://tinyurl.com/2f9aj5  
I'm sure we'll watch Survivor later tonight."
"63003672","","","","","2007-05-13 22:43:40 +0000","web","@perdersoj ...Mickelson looks to be in the driver seat....dry on 17. http://www.pgatour.com/"
"62303902","","","","","2007-05-13 07:11:29 +0000","web","video almost rendered....ready for bed...1AM again..stupid"
"62285162","62247452","3600261","","","2007-05-13 06:46:49 +0000","web","@ssedro...naps rule!"
"62284732","","","","","2007-05-13 06:45:55 +0000","web","editing video...project given tonight due tomorrow."
"62122282","","","","","2007-05-13 03:06:26 +0000","web","hot tub photo   http://flickr.com/photos/shareski/495621723/"
"62121532","","","","","2007-05-13 03:05:49 +0000","web","Daughter having a sleep over, I'm supervising the hottub and using his wireless..very connected neighbourhood. http://flickr.com/photos/shar"
"62116382","62019362","789991","","","2007-05-13 03:00:10 +0000","web","@davecormier....I won't be at CADE but  my colleague will and he really likes beer!"
"62115942","62086602","1298301","","","2007-05-13 02:59:32 +0000","web","@edventures...we need to talk...sent you a direct message"
"61910982","61743462","5634392","","","2007-05-12 22:40:56 +0000","web","@dkuropatwa..tried hiding a geocache a few years ago for my wife's birthday present...didn't go so well..basically had to lead her to it."
"61044282","60663162","5926752","","","2007-05-12 04:41:09 +0000","web","@glassbeed again...here's a video clip taken by the teacher of our polycom conference call.
http://www.prairiesouth.ca/content/view/331/1/"
"61036322","60663162","5926752","","","2007-05-12 04:34:05 +0000","web","@glassbeed....here's a photo of me on the polycom today. http://www.flickr.com/photos/34741011@N00/493990706/in/photostream"
"61018412","60974492","824214","","","2007-05-12 04:11:12 +0000","web","@jutecht...tell me what I have to do to get a golf course around a school!  Also what are the green fees?"
"60962892","","","","","2007-05-12 03:06:53 +0000","web","back from golf...windy cool but always fun..wore a step counter...over 12,000 steps!"
"60683692","","","","","2007-05-11 21:59:32 +0000","web","@highschool teachers...had a great discussion with folks about not giving out zeros."
"60658532","60592422","5926752","","","2007-05-11 21:32:13 +0000","web","@glassbeed Polycom is our video conferencing units..excellent quality of video and  audio viewed on a 42 inch display.
http://www.polycom.co"
"60413672","","","","","2007-05-11 17:24:22 +0000","web","getting ready for a polycom session with some this class http://bengoughss8.edublogs.org/"
"60381452","","","","","2007-05-11 16:55:27 +0000","web","New blog post: Happy Mother's Day http://tinyurl.com/27q4yk"
"60332562","","","","","2007-05-11 16:14:08 +0000","web","New blog post: Learning to be Global Citizens http://tinyurl.com/yw5x9d"
"60260282","","","","","2007-05-11 15:17:54 +0000","web","tee time for 5pm tonight...advantage of living above the 49th parallel."
"60227912","","","","","2007-05-11 14:55:02 +0000","web","@mctoonish....how? (getting a google item to stay unread)"
"59652742","59413692","4453771","","","2007-05-11 06:05:10 +0000","web","@qdsouza....would have liked to been there, was scheduled to do a digital storytelling session there..thanks for the mention"
"59105852","","","","","2007-05-10 21:00:15 +0000","web","sitting in a polycom meeting.."
"59105142","59091042","5926752","","","2007-05-10 20:59:53 +0000","web","@glassbeed...welcome aboard"
"54184962","","","","","2007-05-08 03:39:19 +0000","web","finished teaching my  last digital photography class"
"53796612","","","","","2007-05-07 21:23:38 +0000","web","I get an automated email everyday from kid's school canteen with balance info..only $1.30 left in the account..kids  aren't making lunches!"
"53699072","","","","","2007-05-07 19:51:50 +0000","web","just installed twitter bar http://spatialviews.com/twitterbar/  using it right now!"
"53387342","53347102","673153","","","2007-05-07 15:21:14 +0000","web","@timlauer...your staff will be like kids after Halloween... all hopped up on caffeine!"
"52757792","","","","","2007-05-07 04:43:45 +0000","web","My day: church, dinner at in-laws, 18 holes of golf, watched  tape of Tiger winning, Cattan game with kids, read aggregator,  Seinfeld, bed"
"51619062","","","","","2007-05-06 05:44:21 +0000","web","New blog post: My day in Photos http://tinyurl.com/2cbujz"
"51192802","","","","","2007-05-05 19:17:33 +0000","web","Morning of yardwork...raking, cleaning gutters, poop scooping and putting in screen windows. gotta love old houses"
"50581992","","","","","2007-05-05 05:38:26 +0000","web","kid wants laptop to play with my new gizmo http://www.3dconnexion.com/products/3a1d.php
Only 2 more updates till 100...whatever that means"
"50567412","","","","","2007-05-05 05:17:17 +0000","web","here I thought it was fixed....@cogdog...may have to take your recent advice and uninstall."
"50530582","","","","","2007-05-05 04:25:03 +0000","web","@dnorman  Yikes!  where do I start?  Me and code don't get along so well."
"50517182","","","","","2007-05-05 04:04:42 +0000","web","why does firefox bork my site? http://ideasandthoughts.org  looks fine in IE...D'arcy?"
"50508372","","","","","2007-05-05 03:52:53 +0000","web","New blog post: Podcast 27 Demystifying RSS http://tinyurl.com/2734gs"
"50448212","","","","","2007-05-05 02:33:11 +0000","web","don't forget 24 hours of flickr tomorrow  http://www.flickr.com/groups/24flickr/"
"50446802","50440182","10139","","","2007-05-05 02:31:21 +0000","web","@teach42  no need to apologize, more fun to listen to you fluster...more authentic...it's so you!"
"50427082","50417242","10139","","","2007-05-05 02:06:43 +0000","web","@teach42....always fun to hear you scramble with names! (twiiter podcast)...I was part of this ordeal so neat to hear you retell."
"50423942","","","","","2007-05-05 02:03:32 +0000","web","home from an afternoon with my 8 year old...9 holes of golf, science center and Chuckie Cheese...now I'm tired..listening to teach42 podcast"
"50101962","","","","","2007-05-04 19:22:15 +0000","web","finished a blogging workshop with PE teachers...."
"49336442","","","","","2007-05-04 04:57:46 +0000","web","@teachandlearn  is that Leading and Learning in DeerHurst?  I was suppose to present there.."
"49303162","","","","","2007-05-04 04:11:33 +0000","web","edited and now rendering a video for a local counselling centre...pro bono"
"49016362","","","","","2007-05-03 22:25:58 +0000","web","time to go home...don't forget milk and diet pop"
"48996672","","","","","2007-05-03 22:03:37 +0000","web","updated my wiki for my presentation to PE teachers.http://shareski.wikispaces.com/Blogs @dnorman...too bad there's no script for wikispaces."
"48987462","","","","","2007-05-03 21:54:31 +0000","web","New blog post: Who needs OLPC? http://tinyurl.com/2eu5w9"
"48950932","","","","","2007-05-03 21:16:13 +0000","web","New blog post: Who needs OLPC? http://tinyurl.com/2eu5w9"
"48659502","","","","","2007-05-03 16:17:44 +0000","web","This just came in the mail http://www.3dconnexion.com/products/3a1d.php  might have to take a break from paper work...this is cool!"
"48639792","","","","","2007-05-03 16:01:43 +0000","web","back in the office...paper work...icch"
"47613612","","","","","2007-05-02 19:56:33 +0000","web","@digimon....mac only no good for me"
"47606462","","","","","2007-05-02 19:48:36 +0000","web","looking for free Skype recording tools"
"47597372","","","","","2007-05-02 19:37:40 +0000","web","New blog post: Keyboarding vs. Texting http://tinyurl.com/25moep"
"47592312","","","","","2007-05-02 19:32:15 +0000","web","New blog post: Keyboarding vs. Texting http://tinyurl.com/25moep"
"47425762","","","","","2007-05-02 16:46:20 +0000","web","sitting in a session where they showed http://tinyurl.com/2we7hw  and my Telling the New Story video
http://tinyurl.com/2zs88s"
"47361362","","","","","2007-05-02 15:50:00 +0000","web","Watching a cool video on elearning from the keynote:   http://tinyurl.com/27ncrl"
"47352292","","","","","2007-05-02 15:42:36 +0000","web","dkuropatwa is looking at his kids using their cellphones to twitter using twittercamp...this I got to see!"
"47336982","","","","","2007-05-02 15:29:13 +0000","web","kuropatwa is part of my dream team....Kuropatwa, Fisher and Cassidy"
"46808562","","","","","2007-05-02 05:39:09 +0000","web","@dnorman...cool script!"
"46804342","","","","","2007-05-02 05:33:36 +0000","web","last of 7 nights away from home...miss wife, kids, bed, dog, friends, fridge, moose jaw, better tv"
"46765912","","","","","2007-05-02 04:48:39 +0000","web","bad experience with skype conference call ""jolts of static""  was it poor hotel internet connection? someone with weird levels?"
"46704702","","","","","2007-05-02 03:39:47 +0000","web","New blog post: Twitter...still stupid but effective http://tinyurl.com/268v5o"
"46675172","","","","","2007-05-02 03:07:11 +0000","web","trying out prettymay plugin for Skype recording....seems to be pretty good.
http://www.prettymay.net/download.htm"
"46674362","","","","","2007-05-02 03:06:14 +0000","web","back from golfing...shot 76...played 18 holes in 2 hr. 30 minutes with my brother-in-law....love playing quickly!"
"46399702","","","","","2007-05-01 21:55:28 +0000","web","going golfing tonight..will I get 18 holes in?  It''ll be like my battery. What time is sunset?"
"46398202","","","","","2007-05-01 21:54:31 +0000","web","batttery at 8 minutes...reminds me of the Seinfeld episode when Kramer test drove vehicles...how low can I go?"
"46391162","","","","","2007-05-01 21:46:35 +0000","web","changed batttery, rebooted but the battery wasn't charged...will die soon...save all work...I""m pouched!"
"46387722","","","","","2007-05-01 21:42:57 +0000","web","dnorman and blamb are adding to the wiki as we speak...will Alec share his honorarium with them? Oh yah, he's doing it for FREE!"
"46377542","","","","","2007-05-01 21:31:20 +0000","web","low battery....much change battery..."
"46373342","","","","","2007-05-01 21:27:15 +0000","web","Alec is doing a session on open thinking...http://couros.wikispaces.com/openthinking"
"46366332","","","","","2007-05-01 21:20:11 +0000","web","watching Rob twitter beside me"
"46076222","","","","","2007-05-01 15:04:39 +0000","web","waiting to hear Ian Jukes...http://www.tlt-itsummit2007.ca/program/  long introductions for a zillion people"
